{
  "$schema": "https://json-schema.org/draft/2020-12/schema",
  "title": "sdd.config.json",
  "description": "Configuration for the spec-driven development framework tools.",
  "type": "object",
  "properties": {
    "frameworkVersion": { "type": "string", "description": "Framework version the repository was set up with." },
    "project": {
      "type": "object",
      "properties": {
        "name": { "type": "string" },
        "description": { "type": "string" },
        "scope": { "type": ["string", "null"], "description": "Default organizational scope (a key in the scope map) for documents without scope_name." }
      }
    },
    "adoption": {
      "type": "object",
      "description": "Present when the framework was added to an existing repository with sdd adopt.",
      "properties": {
        "mode": { "enum": ["advisory", "enforced"], "description": "advisory: checks report but never fail." },
        "adopted": { "type": "string" }
      }
    },
    "paths": {
      "type": "object",
      "properties": {
        "docs": { "type": "string", "default": "docs" },
        "codeRoots": { "type": "array", "items": { "type": "string" }, "description": "Folders scanned for @spec annotations in code." },
        "testRoots": { "type": "array", "items": { "type": "string" }, "description": "Folders whose files count as tests." },
        "testPlan": { "type": ["string", "null"], "default": null, "description": "Test plan to read deferred criteria from; null finds the latest docs/test/test-plan-vN.md." },
        "coverage": { "type": "string", "default": "docs/trace/coverage.md", "description": "Generated coverage report (derived status)." },
        "docMap": { "type": "string", "default": "docs/README.md", "description": "File that holds the generated doc map." },
        "traceIndex": { "type": "string", "default": "docs/trace/index.yaml" },
        "scopeMap": { "type": "string", "default": "docs/scope/scope-map.yaml", "description": "Organizational scope map: L0 to L3 units, their parents and owners." },
        "testResults": { "type": ["string", "null"], "default": null, "description": "Optional JUnit XML test report; linked criteria become passing or failing." }
      }
    },
    "ids": {
      "type": "object",
      "properties": {
        "criterionPattern": {
          "type": ["string", "null"],
          "default": null,
          "description": "Optional regular expression for a richer acceptance criterion ID (for example ^(?<prefix>AM)-[A-Z]+-\\d{3}-AC\\d+$). The named group prefix gives the component prefix. The default <PREFIX>-<n> form is always accepted."
        }
      }
    },
    "approvals": {
      "type": "object",
      "properties": {
        "requireApprover": { "type": "boolean", "default": false, "description": "When true, approved documents must record approved_by and approved (date) in front matter." }
      }
    },
    "components": {
      "type": "object",
      "description": "Component name -> requirement ID prefix and the paths that belong to it.",
      "additionalProperties": {
        "type": "object",
        "required": ["prefix"],
        "properties": {
          "prefix": { "type": "string", "pattern": "^[A-Z][A-Z0-9]{1,9}$" },
          "paths": { "type": "array", "items": { "type": "string" } },
          "scope": { "type": "string", "description": "The organizational scope (a key in the scope map) the component belongs to." }
        }
      }
    },
    "trace": {
      "type": "object",
      "properties": {
        "staleAfterDays": { "type": "integer", "minimum": 1, "default": 30 },
        "reachWarnBelow": { "type": "number", "minimum": 0, "maximum": 1, "default": 0.8 }
      }
    },
    "features": {
      "type": "object",
      "description": "Feature flags. Every optional behavior can be switched off without data loss.",
      "properties": {
        "gateHook": { "type": "boolean", "default": true },
        "protectApprovedDocs": { "type": "boolean", "default": true },
        "reachReport": { "type": "boolean", "default": true },
        "divergenceProbe": { "type": "boolean", "default": false },
        "differentialAudit": { "type": "boolean", "default": false },
        "autoAcceptClaudeRecommendations": { "type": "boolean", "default": false, "description": "When true, skills set status: approved on documents they produce and stamp claude_auto_accepted and claude_auto_accepted_at. Gates pass without manual human approval. Inspect all auto-accepted documents with: node tools/sdd/cli.mjs review-auto-accepted" }
      }
    }
  }
}
